Ticker,Date,Article title,Article sentiment
SLNH,2024-05-08T12:00:00.000Z,Soluna Launches New AI Cloud Service in Collaboration with Leading High Performance Computing Company,neutral
SLNH,2024-05-06T12:00:00.000Z,Soluna Announces Monthly Business Update,neutral
SLNH,2024-04-22T12:00:00.000Z,Soluna to Participate in Water Tower Research Fireside Chat Series,neutral
SLNH,None,AI & Technology Hybrid Investor Conference Agenda: Presentations Now Available for Online Viewing,positive
SLNH,2024-04-09T14:26:00.000Z,AI & Technology Hybrid Investor Conference Presented by Water Tower Research Agenda Announced for April 10 and 11,neutral
SLNH,2024-04-03T12:00:00.000Z,Soluna Appoints John Tunison as Chief Financial Officer,neutral
SLNH,None,Soluna Holdings Full Year 2023 Earnings: US$0.022 loss per share (vs US$185 loss in FY 2022),positive
SLNH,2024-04-02T12:00:00.000Z,Soluna Reports Fourth Quarter and Full Year 2023 Results,neutral
