Ticker,Date,Article title,Article sentiment
TIVC,2024-05-08T13:00:00.000Z,"Tivic Health Announces Successful Completion of Non-Invasive Vagus Nerve Stimulation Study (VNS); Demonstrates Clinically Effective Biological Changes in the Autonomic, Cardiac, and Central Nervous Systems",neutral
TIVC,2024-03-28T14:03:28.000Z,"Tivic Health Systems, Inc. (NASDAQ:TIVC) Q4 2023 Earnings Call Transcript",neutral
TIVC,2024-03-27T10:49:56.000Z,Tivic Health Systems Full Year 2023 Earnings: US$10.40 loss per share (vs US$104 loss in FY 2022),neutral
TIVC,2024-03-25T21:25:00.000Z,Tivic Reports Fiscal Year 2023 Financial Results,neutral
TIVC,2024-03-19T20:30:00.000Z,Tivic Health to Report 2023 Year-End Financial Results on March 25th Via Conference Call and Webcast,neutral
TIVC,2024-02-21T14:00:00.000Z,Tivic Health Announces Completion of Enrollment for Study of Novel Non-Invasive Bioelectronic Approach to Vagus Nerve Stimulation,neutral
